{"association_only":true,"coefficient_fields":"beta/se/ci_lo/ci_hi are on the log-trips scale; pct_effect = exp(beta)-1 (per unit of the term); p is HAC two-sided","models":{"bins":{"adj_r2":0.7101135100165301,"coefficients":[{"beta":13.377867826272542,"ci_hi":13.43195965716889,"ci_lo":13.323775995376193,"p":0.0,"pct_ci_hi":681436.391460748,"pct_ci_lo":611563.6764347367,"pct_effect":645555.3784978221,"se":0.027598380033009833,"term":"const"},{"beta":0.02398558986847471,"ci_hi":0.05067063447204673,"ci_lo":-0.0026994547350973064,"p":0.07812095308663031,"pct_ci_hi":0.05197635147047672,"pct_ci_lo":-0.002695814483465442,"pct_effect":0.024275557838768048,"se":0.01361506885537706,"term":"prcp_light"},{"beta":0.025974366446130215,"ci_hi":0.045909116464864924,"ci_lo":0.006039616427395502,"p":0.010656275968100664,"pct_ci_hi":0.04697925345711043,"pct_ci_lo":0.0060578916840123885,"pct_effect":0.02631464004464136,"se":0.010170977719987448,"term":"prcp_moderate"},{"beta":0.0669227505229435,"ci_hi":0.09820658997238735,"ci_lo":0.03563891107349964,"p":2.755595838540919e-05,"pct_ci_hi":0.10319066969835264,"pct_ci_lo":0.03628158911832692,"pct_effect":0.06921287884851078,"se":0.015961435871376613,"term":"prcp_heavy"},{"beta":-0.04351965882919548,"ci_hi":0.036507576117515456,"ci_lo":-0.12354689377590641,"p":0.2864918184386259,"pct_ci_hi":0.037182161801926655,"pct_ci_lo":-0.11621980351814903,"pct_effect":-0.04258626772707209,"se":0.04083097219028286,"term":"snow_day"},{"beta":-0.023946483432167737,"ci_hi":-0.003864845487086977,"ci_lo":-0.0440281213772485,"p":0.019430234264544047,"pct_ci_hi":-0.0038573865840307526,"pct_ci_lo":-0.04307295301181915,"pct_effect":-0.02366204138360344,"se":0.01024592191666896,"term":"tmax_per10c"},{"beta":-0.10192741831187657,"ci_hi":-0.03841687113861668,"ci_lo":-0.16543796548513645,"p":0.0016578853380086337,"pct_ci_hi":-0.03768830270938175,"pct_ci_lo":-0.15247756278256716,"pct_effect":-0.09690490254315452,"se":0.032403935824445236,"term":"holiday"},{"beta":0.0454246259669826,"ci_hi":0.06294179355681043,"ci_lo":0.027907458377154776,"p":3.725411259117246e-07,"pct_ci_hi":0.06496484961120753,"pct_ci_lo":0.028300519419291445,"pct_effect":0.04647212481675416,"se":0.008937494631534563,"term":"dow_tue"},{"beta":0.10135377800567413,"ci_hi":0.12113732391766324,"ci_lo":0.08157023209368502,"p":1.0048518730087909e-23,"pct_ci_hi":0.1287799102040941,"pct_ci_lo":0.08498941598649251,"pct_effect":0.10666808734580646,"se":0.010093831349983571,"term":"dow_wed"},{"beta":0.15054062317665629,"ci_hi":0.17183277412387077,"ci_lo":0.1292484722294418,"p":1.1473011359645891e-43,"pct_ci_hi":0.18747923935316638,"pct_ci_lo":0.13797284368981763,"pct_effect":0.16246252706456923,"se":0.010863541940139849,"term":"dow_thu"},{"beta":0.21908849715557685,"ci_hi":0.24199902535183532,"ci_lo":0.19617796895931838,"p":2.219938086950472e-78,"pct_ci_hi":0.27379295131562764,"pct_ci_lo":0.21674342862828255,"pct_effect":0.24494144558943645,"se":0.011689259790982785,"term":"dow_fri"},{"beta":0.2757073343546869,"ci_hi":0.2995452407648222,"ci_lo":0.25186942794455164,"p":9.106696667404712e-114,"pct_ci_hi":0.3492450863753405,"pct_ci_lo":0.28642805476287087,"pct_effect":0.3174622316651779,"se":0.012162420635361484,"term":"dow_sat"},{"beta":0.12346315439288591,"ci_hi":0.13862026670320063,"ci_lo":0.10830604208257118,"p":2.2403269369409152e-57,"pct_ci_hi":0.14868782216053344,"pct_ci_lo":0.11438874305570627,"pct_effect":0.13140831634776026,"se":0.007733362668840907,"term":"dow_sun"},{"beta":0.05407744515570462,"ci_hi":0.10400424464684982,"ci_lo":0.004150645664559416,"p":0.03376182580339721,"pct_ci_hi":0.10960516478765392,"pct_ci_lo":0.004159271524442693,"pct_effect":0.055566347489787,"se":0.025473324961561246,"term":"month_02"},{"beta":0.08539463805274482,"ci_hi":0.13351224550744828,"ci_lo":0.03727703059804134,"p":0.0005044897772208175,"pct_ci_hi":0.1428352606471206,"pct_ci_lo":0.03798053337935003,"pct_effect":0.08914680067070241,"se":0.02455025083840776,"term":"month_03"},{"beta":0.07959172008846838,"ci_hi":0.13288049032403715,"ci_lo":0.026302949852899597,"p":0.0034182218526226963,"pct_ci_hi":0.14211349656052877,"pct_ci_lo":0.026651925415638007,"pct_effect":0.08284487360242582,"se":0.027188647677153153,"term":"month_04"},{"beta":0.10262976920422745,"ci_hi":0.1639266841419488,"ci_lo":0.041332854266506104,"p":0.0010322770741736486,"pct_ci_hi":0.1781279364657432,"pct_ci_lo":0.04219894818470259,"pct_effect":0.10808108738106874,"se":0.031274510869191266,"term":"month_05"},{"beta":0.12363958784849338,"ci_hi":0.18360848273777888,"ci_lo":0.06367069295920788,"p":5.3243311490048095e-05,"pct_ci_hi":0.201545305266033,"pct_ci_lo":0.06574138482731018,"pct_effect":0.1316079522374236,"se":0.030596937169413564,"term":"month_06"},{"beta":0.04286650342185594,"ci_hi":0.11050791438415382,"ci_lo":-0.02477490754044194,"p":0.21420290662565633,"pct_ci_hi":0.11684518815899958,"pct_ci_lo":-0.024470528355057485,"pct_effect":0.043798542015625386,"se":0.03451155811833519,"term":"month_07"},{"beta":0.006315740193351127,"ci_hi":0.06955352508284021,"ci_lo":-0.05692204469613796,"p":0.8448079893650583,"pct_ci_hi":0.07202944013374155,"pct_ci_lo":-0.05533229164553535,"pct_effect":0.0063357265344708875,"se":0.03226476883672387,"term":"month_08"},{"beta":0.08562670635845215,"ci_hi":0.14074640319309858,"ci_lo":0.03050700952380573,"p":0.0023287992586205936,"pct_ci_hi":0.15113268739232932,"pct_ci_lo":0.030977116682095733,"pct_effect":0.08939958645405036,"se":0.028122811066643858,"term":"month_09"},{"beta":0.09185256169087452,"ci_hi":0.14772206573888477,"ci_lo":0.03598305764286427,"p":0.0012717059878342,"pct_ci_hi":0.15919067278343021,"pct_ci_lo":0.03663828324612744,"pct_effect":0.0962031878210985,"se":0.02850537279700126,"term":"month_10"},{"beta":0.08190421336030873,"ci_hi":0.14572154923978814,"ci_lo":0.018086877480829308,"p":0.01188805868375094,"pct_ci_hi":0.15687401074985804,"pct_ci_lo":0.01825143566676011,"pct_effect":0.08535184264440526,"se":0.032560463550790945,"term":"month_11"},{"beta":0.07735075867142172,"ci_hi":0.18752526992351481,"ci_lo":-0.03282375258067137,"p":0.16880878123341336,"pct_ci_hi":0.2062607311522587,"pct_ci_lo":-0.03229089920845753,"pct_effect":0.08042097696384108,"se":0.0562125182509146,"term":"month_12"}],"dropped_days":0,"n":366,"r2":0.7283803299332967,"se":"HAC Newey-West maxlags=7","spec":"log(daily trips, all services) ~ precip bins (ref: dry < 0.1 mm) + snow_day + TMAX per 10C + dow + month + federal holiday"},"continuous":{"adj_r2":0.7104262314348136,"coefficients":[{"beta":13.383405954779116,"ci_hi":13.436996080121197,"ci_lo":13.329815829437035,"p":0.0,"pct_ci_hi":684877.0554262847,"pct_ci_lo":615268.6029055755,"pct_effect":649140.470868156,"se":0.027342403107809006,"term":"const"},{"beta":0.0019803466747025785,"ci_hi":0.002820071518253012,"ci_lo":0.001140621831152145,"p":3.7962194433107426e-06,"pct_ci_hi":0.0028240516604862032,"pct_ci_lo":0.001141272587631825,"pct_effect":0.0019823088562313518,"se":0.00042843891529338086,"term":"prcp_per_mm"},{"beta":-0.030765841864993967,"ci_hi":0.04393748549274504,"ci_lo":-0.10546916922273297,"p":0.41955576772864367,"pct_ci_hi":0.04491703037332401,"pct_ci_lo":-0.10009778289608968,"pct_effect":-0.030297389751585604,"se":0.03811464289496609,"term":"snow_day"},{"beta":-0.02189374348571113,"ci_hi":-0.0018213903125426263,"ci_lo":-0.04196609665887964,"p":0.032531878322095316,"pct_ci_hi":-0.0018197325878146447,"pct_ci_lo":-0.04109770998716848,"pct_effect":-0.02165581502869601,"se":0.010241184701094851,"term":"tmax_per10c"},{"beta":-0.09700239938026023,"ci_hi":-0.031478955457805755,"ci_lo":-0.1625258433027147,"p":0.0037129148363152856,"pct_ci_hi":-0.03098865136062003,"pct_ci_lo":-0.15000587671388357,"pct_effect":-0.09244617143608111,"se":0.033430942833284204,"term":"holiday"},{"beta":0.04368441717622157,"ci_hi":0.06168815818094032,"ci_lo":0.02568067617150282,"p":1.9778752183696497e-06,"pct_ci_hi":0.06363060850234502,"pct_ci_lo":0.026013265673679644,"pct_effect":0.04465262843682831,"se":0.009185750935593696,"term":"dow_tue"},{"beta":0.10177704465013837,"ci_hi":0.12182796445621163,"ci_lo":0.0817261248440651,"p":2.5565821819973808e-23,"pct_ci_hi":0.12955976063634328,"pct_ci_lo":0.0851585711553736,"pct_effect":0.10713660218002913,"se":0.010230249108775652,"term":"dow_wed"},{"beta":0.15212709493081364,"ci_hi":0.17338427498942072,"ci_lo":0.13086991487220656,"p":1.0733365110998033e-44,"pct_ci_hi":0.18932304438353534,"pct_ci_lo":0.13981949810240718,"pct_effect":0.16430820469962684,"se":0.01084569932217174,"term":"dow_thu"},{"beta":0.21979378357504964,"ci_hi":0.24227070522183192,"ci_lo":0.19731686192826736,"p":7.146721087701155e-82,"pct_ci_hi":0.27413906223259926,"pct_ci_lo":0.21812995856889278,"pct_effect":0.2458197955918039,"se":0.011468027894429371,"term":"dow_fri"},{"beta":0.2736823399475862,"ci_hi":0.29677889282512726,"ci_lo":0.2505857870700451,"p":2.571352560120871e-119,"pct_ci_hi":0.3455177629242784,"pct_ci_lo":0.2847778025218782,"pct_effect":0.3147970773864718,"se":0.011784172086693303,"term":"dow_sat"},{"beta":0.12265215969463794,"ci_hi":0.13808928667909265,"ci_lo":0.10721503271018323,"p":1.120407252209379e-54,"pct_ci_hi":0.1480780537747727,"pct_ci_lo":0.11317359748068692,"pct_effect":0.13049112217172643,"se":0.007876229923723499,"term":"dow_sun"},{"beta":0.05229326472378435,"ci_hi":0.10425257716727374,"ci_lo":0.00033395228029496626,"p":0.04854559524978704,"pct_ci_hi":0.1098807500518764,"pct_ci_lo":0.000334008048565531,"pct_effect":0.053684705761330526,"se":0.02651034042122091,"term":"month_02"},{"beta":0.07909006441226817,"ci_hi":0.12981227285856362,"ci_lo":0.028367855965972702,"p":0.002242137999328952,"pct_ci_hi":0.13861461439337666,"pct_ci_lo":0.028774055498082294,"pct_effect":0.08230179455587122,"se":0.02587915331423729,"term":"month_03"},{"beta":0.07922398170003542,"ci_hi":0.13621215990216734,"ci_lo":0.02223580349790351,"p":0.006435835801930239,"pct_ci_hi":0.1459249871397613,"pct_ci_lo":0.022484861552819074,"pct_effect":0.0824467431820